{
  "schema_version": 1,
  "skill": "ability:combat",
  "display": {
    "name": "ability.ability.charged_leap",
    "description": "ability.ability.charged_leap.description",
    "icon": "minecraft:wind_charge",
    "sort_order": 40
  },
  "purchase": {
    "skill_level": 18,
    "skill_points": 6,
    "requirements": [
      {
        "type": "ability:skill_level",
        "config": { "skill": "ability:agility", "level": 10 }
      }
    ]
  },
  "ranks": {
    "unlock_skill_levels": [18, 20, 22, 24, 26, 28, 30],
    "values": [
      { "damage_multiplier": 1.40, "stun_seconds": 1.0 },
      { "damage_multiplier": 1.50, "stun_seconds": 1.3 },
      { "damage_multiplier": 1.60, "stun_seconds": 1.6 },
      { "damage_multiplier": 1.70, "stun_seconds": 1.9 },
      { "damage_multiplier": 1.80, "stun_seconds": 2.2 },
      { "damage_multiplier": 1.90, "stun_seconds": 2.5 },
      { "damage_multiplier": 2.05, "stun_seconds": 2.6 }
    ]
  },
  "effect": {
    "type": "ability:charged_leap",
    "config": {
      "impact_radius": 5.0,
      "maximum_charge_ticks": 20,
      "minimum_vertical_speed": 0.42,
      "maximum_vertical_speed": 0.74,
      "leap_timeout_ticks": 100,
      "double_jump_unlock_rank": 6,
      "double_jump_vertical_speed": 0.42
    }
  }
}
