{
  "schema_version": 1,
  "skill": "ability:archery",
  "display": {
    "name": "ability.ability.dangerous_charge",
    "description": "ability.ability.dangerous_charge.description",
    "icon": "minecraft:firework_rocket",
    "sort_order": 10
  },
  "purchase": {
    "skill_level": 16,
    "skill_points": 5,
    "requirements": [
      {
        "type": "ability:skill_level",
        "config": { "skill": "ability:building", "level": 8 }
      }
    ]
  },
  "ranks": {
    "unlock_skill_levels": [16, 17, 18, 19, 20, 21, 22, 23, 24, 25],
    "values": [
      { "explosion_damage_bonus": 60 },
      { "explosion_damage_bonus": 63 },
      { "explosion_damage_bonus": 67 },
      { "explosion_damage_bonus": 70 },
      { "explosion_damage_bonus": 74 },
      { "explosion_damage_bonus": 77 },
      { "explosion_damage_bonus": 80 },
      { "explosion_damage_bonus": 84 },
      { "explosion_damage_bonus": 87 },
      { "explosion_damage_bonus": 90 }
    ]
  },
  "effect": {
    "type": "ability:dangerous_charge",
    "config": {
      "projectile_state_ticks": 1200
    }
  }
}
