{
  "schema_version": 1,
  "skill": "ability:gathering",
  "display": {
    "name": "ability.ability.sniffer_treasure",
    "description": "ability.ability.sniffer_treasure.description",
    "icon": "minecraft:torchflower_seeds",
    "sort_order": 10
  },
  "purchase": {
    "skill_level": 12,
    "skill_points": 6,
    "requirements": [
      { "type": "ability:skill_level", "config": { "skill": "ability:husbandry", "level": 8 } }
    ]
  },
  "ranks": { "unlock_skill_levels": [12], "values": [{}] },
  "effect": {
    "type": "ability:companion_gift",
    "config": {
      "source": "sniffer_digging",
      "player_radius": 16,
      "chance": 0.25,
      "rolls": 1,
      "entries": [
        { "item": "minecraft:snort_pottery_sherd", "weight": 30 },
        { "item": "minecraft:nautilus_shell", "weight": 25 },
        { "item": "minecraft:echo_shard", "weight": 20 },
        { "item": "minecraft:diamond", "weight": 15 },
        { "item": "minecraft:music_disc_relic", "weight": 10 }
      ]
    }
  }
}
