{
  "schema_version": 1,
  "skill": "ability:archery",
  "display": {
    "name": "ability.ability.primer",
    "description": "ability.ability.primer.description",
    "icon": "minecraft:fire_charge",
    "sort_order": 30
  },
  "purchase": {
    "skill_level": 10,
    "skill_points": 4,
    "requirements": [
      {
        "type": "ability:skill_level",
        "config": { "skill": "ability:magic", "level": 4 }
      }
    ]
  },
  "ranks": {
    "unlock_skill_levels": [10, 11, 12, 13, 14, 15, 16, 17, 18, 19],
    "values": [
      { "charge_seconds": 2.0, "explosion_damage_bonus": 25 },
      { "charge_seconds": 2.0, "explosion_damage_bonus": 28 },
      { "charge_seconds": 2.0, "explosion_damage_bonus": 30 },
      { "charge_seconds": 2.0, "explosion_damage_bonus": 32 },
      { "charge_seconds": 1.5, "explosion_damage_bonus": 34 },
      { "charge_seconds": 1.5, "explosion_damage_bonus": 36 },
      { "charge_seconds": 1.5, "explosion_damage_bonus": 38 },
      { "charge_seconds": 1.5, "explosion_damage_bonus": 40 },
      { "charge_seconds": 1.0, "explosion_damage_bonus": 42 },
      { "charge_seconds": 1.0, "explosion_damage_bonus": 45 }
    ]
  },
  "effect": {
    "type": "ability:primer",
    "config": {
      "explosion_power": 1,
      "projectile_state_ticks": 1200,
      "spawn_offset": 0.5
    }
  }
}
