{
  "schema_version": 1,
  "skill": "ability:combat",
  "display": {
    "name": "ability.ability.ambush",
    "description": "ability.ability.ambush.description",
    "icon": "minecraft:stone_sword",
    "sort_order": 30
  },
  "purchase": {
    "skill_level": 16,
    "skill_points": 6,
    "requirements": []
  },
  "ranks": {
    "unlock_skill_levels": [16, 17, 18, 19, 20, 21, 22, 23, 24, 25],
    "values": [
      { "damage_multiplier": 1.10 },
      { "damage_multiplier": 1.20 },
      { "damage_multiplier": 1.40 },
      { "damage_multiplier": 1.50 },
      { "damage_multiplier": 1.70 },
      { "damage_multiplier": 1.80 },
      { "damage_multiplier": 1.90 },
      { "damage_multiplier": 2.10 },
      { "damage_multiplier": 2.20 },
      { "damage_multiplier": 2.40 }
    ]
  },
  "effect": {
    "type": "ability:damage_modifier",
    "config": {
      "target_state": "mob_without_target",
      "directness": "any"
    }
  }
}
