{
  "schema_version": 1,
  "skill": "ability:defense",
  "display": {
    "name": "ability.ability.retaliatory_flame",
    "description": "ability.ability.retaliatory_flame.description",
    "icon": "minecraft:soul_campfire",
    "sort_order": 10
  },
  "purchase": {
    "skill_level": 12,
    "skill_points": 4,
    "requirements": []
  },
  "ranks": {
    "unlock_skill_levels": [12, 13, 14, 15, 16, 17, 18, 19, 20, 21],
    "values": [
      { "radius": 2.5 },
      { "radius": 3.0 },
      { "radius": 3.5 },
      { "radius": 4.0 },
      { "radius": 4.5 },
      { "radius": 5.0 },
      { "radius": 5.5 },
      { "radius": 6.0 },
      { "radius": 6.5 },
      { "radius": 7.5 }
    ]
  },
  "effect": {
    "type": "ability:retaliatory_flame",
    "config": {
      "check_interval_ticks": 20,
      "burn_duration_seconds": 3.0,
      "soul_fire_damage": 2.0,
      "lava_damage": 4.0,
      "normal_fire_block_tag": "ability:retaliatory_flame_normal_fire",
      "soul_fire_block_tag": "ability:retaliatory_flame_soul_fire",
      "lava_fluid_tag": "ability:retaliatory_flame_lava"
    }
  }
}
