{
  "schema_version": 1,
  "skill": "ability:building",
  "display": { "name": "ability.ability.chorus_transmutation", "description": "ability.ability.chorus_transmutation.description", "icon": "minecraft:chorus_fruit", "sort_order": 10 },
  "purchase": { "skill_level": 22, "skill_points": 10, "requirements": [
    { "type": "ability:skill_level", "config": { "skill": "ability:magic", "level": 16 } }
  ]},
  "ranks": {
    "unlock_skill_levels": [22,23,24,25,26,27,28,29,30,31],
    "values": [{},{},{},{},{},{},{},{},{},{}]
  },
  "effect": { "type": "ability:chorus_transmutation", "config": {
    "catalyst": "minecraft:chorus_fruit",
    "recipes": [
      {"minimum_rank":1,"first":"minecraft:coal_ore","second":"minecraft:magma_block"},
      {"minimum_rank":1,"first":"minecraft:clay","second":"minecraft:soul_soil"},
      {"minimum_rank":2,"first":"minecraft:quartz_block","second":"minecraft:amethyst_block"},
      {"minimum_rank":2,"first":"minecraft:sand","second":"minecraft:soul_sand"},
      {"minimum_rank":3,"first":"minecraft:gold_ore","second":"minecraft:gilded_blackstone"},
      {"minimum_rank":3,"first":"minecraft:moss_block","second":"minecraft:sculk"},
      {"minimum_rank":4,"first":"minecraft:redstone_ore","second":"minecraft:glowstone"},
      {"minimum_rank":4,"first":"minecraft:grass_block","second":"minecraft:mycelium"},
      {"minimum_rank":5,"first":"minecraft:purpur_block","second":"minecraft:prismarine"},
      {"minimum_rank":5,"first":"minecraft:emerald_ore","second":"minecraft:diamond_ore"},
      {"minimum_rank":6,"first":"minecraft:iron_ore","second":"minecraft:gold_ore","bidirectional":false,"experience_cost_per_rank":1,"experience_cost_rank_offset":5},
      {"minimum_rank":7,"first":"minecraft:skeleton_skull","second":"minecraft:wither_skeleton_skull","bidirectional":false,"experience_cost_per_rank":1,"experience_cost_rank_offset":5},
      {"minimum_rank":8,"first":"minecraft:copper_ore","second":"minecraft:lapis_ore","bidirectional":false,"experience_cost_per_rank":1,"experience_cost_rank_offset":5},
      {"minimum_rank":9,"first":"minecraft:crying_obsidian","second":"minecraft:deepslate_diamond_ore","bidirectional":false,"experience_cost_per_rank":1,"experience_cost_rank_offset":5},
      {"minimum_rank":10,"first":"minecraft:reinforced_deepslate","second":"minecraft:ancient_debris","bidirectional":false,"experience_cost_per_rank":1,"experience_cost_rank_offset":5}
    ]
  }}
}
