{
  "schema_version": 1,
  "skill": "ability:agility",
  "display": {
    "name": "ability.ability.stealth",
    "description": "ability.ability.stealth.description",
    "icon": "minecraft:fermented_spider_eye",
    "sort_order": 20
  },
  "purchase": {
    "skill_level": 18,
    "skill_points": 8,
    "requirements": [
      {
        "type": "ability:skill_level",
        "config": { "skill": "ability:combat", "level": 6 }
      }
    ]
  },
  "ranks": {
    "unlock_skill_levels": [18, 19, 20, 21, 22, 23, 24, 25, 26, 27],
    "values": [
      { "wait_seconds": 12, "damage_multiplier": 2.00 },
      { "wait_seconds": 12, "damage_multiplier": 2.15 },
      { "wait_seconds": 12, "damage_multiplier": 2.30 },
      { "wait_seconds": 12, "damage_multiplier": 2.45 },
      { "wait_seconds": 11, "damage_multiplier": 2.45 },
      { "wait_seconds": 11, "damage_multiplier": 2.60 },
      { "wait_seconds": 11, "damage_multiplier": 2.75 },
      { "wait_seconds": 10, "damage_multiplier": 2.75 },
      { "wait_seconds": 10, "damage_multiplier": 2.90 },
      { "wait_seconds": 9, "damage_multiplier": 3.00 }
    ]
  },
  "effect": {
    "type": "ability:stealth",
    "config": {
      "mark_id": "ability:stealth",
      "effect": "minecraft:invisibility",
      "effect_duration_ticks": 12,
      "show_particles": false,
      "show_icon": true
    }
  }
}
