{
  "schema_version": 1,
  "skill": "ability:archery",
  "display": {
    "name": "ability.ability.counter_sniper",
    "description": "ability.ability.counter_sniper.description",
    "icon": "minecraft:spyglass",
    "sort_order": 20
  },
  "purchase": {
    "skill_level": 22,
    "skill_points": 6,
    "requirements": [
      {
        "type": "ability:skill_level",
        "config": { "skill": "ability:agility", "level": 10 }
      }
    ]
  },
  "ranks": {
    "unlock_skill_levels": [22, 23, 24, 25, 26],
    "values": [
      { "damage_multiplier": 1.20 },
      { "damage_multiplier": 1.30 },
      { "damage_multiplier": 1.40 },
      { "damage_multiplier": 1.45 },
      { "damage_multiplier": 1.50 }
    ]
  },
  "effect": {
    "type": "ability:counter_sniper",
    "config": {
      "mark_id": "ability:prey",
      "minimum_distance": 8.0,
      "glowing": true
    }
  }
}
