{
  "schema_version": 1,
  "skill": "ability:combat",
  "display": {
    "name": "ability.example.damage_reduction",
    "description": "ability.example.damage_reduction.description",
    "icon": "minecraft:shield",
    "sort_order": 902
  },
  "purchase": {
    "skill_level": 1,
    "skill_points": 1,
    "requirements": []
  },
  "ranks": {
    "unlock_skill_levels": [1, 10, 20],
    "values": [
      {
        "damage_multiplier": 0.95
      },
      {
        "damage_multiplier": 0.9,
        "flat_reduction": 0.5
      },
      {
        "damage_multiplier": 0.8,
        "flat_reduction": 1.0
      }
    ]
  },
  "effect": {
    "type": "ability:damage_reduction",
    "config": {
      "attacker_entity_type_tags": ["minecraft:raiders"],
      "directness": "any"
    }
  }
}
