{
  "schema_version": 1,
  "skill": "ability:husbandry",
  "display": {
    "name": "ability.ability.support_aura",
    "description": "ability.ability.support_aura.description",
    "icon": "minecraft:golden_apple",
    "sort_order": 10
  },
  "purchase": {
    "skill_level": 12,
    "skill_points": 6,
    "requirements": [
      { "type": "ability:skill_level", "config": { "skill": "ability:farming", "level": 8 } }
    ]
  },
  "ranks": {
    "unlock_skill_levels": [12, 13, 14, 15, 16, 17, 18, 19, 20, 21],
    "values": [
      { "total_healing_percent": 60 },
      { "total_healing_percent": 70 },
      { "total_healing_percent": 80 },
      { "total_healing_percent": 90 },
      { "total_healing_percent": 100 },
      { "total_healing_percent": 110 },
      { "total_healing_percent": 120 },
      { "total_healing_percent": 130 },
      { "total_healing_percent": 140 },
      { "total_healing_percent": 150 }
    ]
  },
  "effect": {
    "type": "ability:support_aura",
    "config": {
      "radius": 12,
      "pulse_interval_ticks": 100,
      "pulse_count": 5,
      "absorption_effect": "minecraft:absorption",
      "absorption_amplifier": 49,
      "absorption_duration_ticks": 500,
      "triggers": [
        { "minimum_rank": 1, "item": "minecraft:snow_block", "target_entity_type_tag": "ability:support_snow_golems" },
        { "minimum_rank": 2, "item": "minecraft:iron_ingot", "target_entity_type_tag": "ability:support_iron_golems" },
        { "minimum_rank": 3, "item": "minecraft:rabbit_stew", "target_entity_type_tag": "ability:support_wolves", "remainder_item": "minecraft:bowl" },
        { "minimum_rank": 4, "item": "minecraft:golden_apple", "target_entity_type_tag": "ability:support_equines", "grant_absorption": true },
        { "minimum_rank": 5, "item": "minecraft:hay_block", "target_entity_type_tag": "ability:support_llamas" },
        { "minimum_rank": 6, "item": "minecraft:golden_carrot", "target_entity_type_tag": "ability:support_pigs", "grant_absorption": true }
      ]
    }
  }
}
